{
  "$schema": "https://json-schema.org/draft/2020-12/schema",
  "$id": "https://github.com/tabsy-gr/chords-db/schema/instrument.schema.json",
  "title": "Instrument",
  "description": "An instrument: its tunings and the chord keys and suffixes it covers.",
  "type": "object",
  "required": ["id", "name", "kind", "keys", "suffixes"],
  "additionalProperties": false,
  "properties": {
    "$schema": { "type": "string" },
    "id": {
      "description": "Instrument id; also its directory name under data/.",
      "type": "string",
      "pattern": "^[a-z0-9-]+$"
    },
    "name": { "type": "string", "minLength": 1 },
    "kind": { "enum": ["fretted", "keyboard"] },
    "tunings": {
      "description": "Fretted only. Each tuning lists the courses from lowest to highest; each course lists the pitches of its strings (one for a single string, several for unison or octave courses).",
      "type": "object",
      "minProperties": 1,
      "additionalProperties": {
        "type": "array",
        "minItems": 1,
        "items": {
          "type": "array",
          "minItems": 1,
          "items": { "$ref": "#/$defs/pitch" }
        }
      }
    },
    "maxFretSpan": {
      "description": "Fretted only. The largest distance allowed between the lowest and highest fretted notes of a voicing.",
      "type": "integer",
      "minimum": 1
    },
    "keyCount": {
      "description": "Keyboard only. Number of keys on the instrument.",
      "type": "integer",
      "minimum": 1
    },
    "keys": {
      "description": "The chord roots covered, in display order.",
      "type": "array",
      "uniqueItems": true,
      "items": { "$ref": "#/$defs/noteName" }
    },
    "suffixes": {
      "description": "The chord suffixes covered, in display order.",
      "type": "array",
      "uniqueItems": true,
      "items": { "type": "string", "minLength": 1 }
    }
  },
  "allOf": [
    {
      "if": { "properties": { "kind": { "const": "fretted" } } },
      "then": { "required": ["tunings", "maxFretSpan"], "not": { "required": ["keyCount"] } }
    },
    {
      "if": { "properties": { "kind": { "const": "keyboard" } } },
      "then": { "required": ["keyCount"], "not": { "anyOf": [{ "required": ["tunings"] }, { "required": ["maxFretSpan"] }] } }
    }
  ],
  "$defs": {
    "noteName": { "type": "string", "pattern": "^[A-G](#|b)?$" },
    "pitch": { "type": "string", "pattern": "^[A-G](#|b)?[0-9]$" }
  }
}
