{
  "$schema": "../../schema/instrument.schema.json",
  "id": "cavaquinho",
  "name": "Cavaquinho",
  "kind": "fretted",
  "tunings": { "standard": [["D3"], ["G3"], ["B3"], ["D4"]] },
  "maxFretSpan": 4,
  "keys": ["C", "Db", "D", "Eb", "E", "F", "Gb", "G", "Ab", "A", "Bb", "B"],
  "suffixes": [
    "major",
    "minor",
    "7",
    "maj7",
    "m7",
    "m7b5",
    "dim",
    "dim7",
    "sus4",
    "7sus4",
    "sus2",
    "6",
    "m6",
    "9",
    "add9"
  ]
}
